{
  "name": "Clash for Glory: Road to All-Star S1",
  "game": "crossfire-legends",
  "region": "ID",
  "startDate": "2026-08-22",
  "endDate": "2026-08-23",
  "status": "completed",
  "format": "single-elimination",
  "teams": [
    "anv",
    "brotherhood",
    "cha-tra-mue",
    "endevour-tvj",
    "familia-nova",
    "g2c-prmx",
    "glory-solidarity",
    "howl-tvj",
    "scissor-rex",
    "solidarity",
    "team-69",
    "tvj-ghoib",
    "unclex-sederhana"
  ],
  "winner": "cha-tra-mue"
}